review_uid,product_name,product_price,product_type,username_1,username_2,rating,review_content,review_date
17569,,,,,간****,5,사용 후유튜브 양대산맥 보고 구매 한건데 냄새 좋은데요ㆍ강하지도 않고  좋아요,2021.1.19
17496,,,,,우****,5,"전체적으로 만족스럽네용.시향은 안해보고 구매한 거라 긴가민가, 걱정도 되었는데 막상받아서 향을 맡아보니, 괜한 걱정이였네요. ㅎㅎ 향 너무 만족스럽네여.",2021.1.14
17497,,,,,박****,5,"더바디 남자 향수얼마전에 샘플로 받아 사용했는데,향이 너무 좋아서 이번에 구입향이 너무 좋아요 ㅎㅎ",2021.1.14
22695,,,,,고****,5,좋아요 싸게 잘 샀네요,2021.1.14
22691,,,,,임****,5,자꾸 향에 빠져드네요..오리지널에서 미드나잇으로 갈아탔다가 다시 오리지널로 돌아왔네요..처음 접한 향을 잊을 수 없었나 보네요.몇년전 처음 알게된 후 지금까지 오로지 아프리모만 사용하고 있네요.뭔지 모를 향이 자꾸 빠져들게 만드는 것 같습니다.기간한정 가격할인에 득템했네요. 감사...,2021.1.2
22692,,,,,임****,5,더바디 오리지널여기 향수가 다 향이 좋네요. 특히 오리지널이 너무 좋아서 남자 오리지널도 어떨까 재구매하려고 들어와봤어요. 향이 은은해서 목욕탕에 두고 쓰네요,2021.1.1
26011,,,,,송****,5,남자향 더바디덕분에 하루하루 기분이좋고  향 좋다고 주변에서 너무 좋아하네요~~,2020.12.31
22693,,,,,박****,5,맨날삼자주삼 몽땅삼ㅋㅋ,2020.12.29
17477,,,,,황****,5,잘쓰겠습니다아직써보진않았지만 포장도깔끔하고 가격이상할거같네요 잘쓸게요,2020.12.29
17478,,,,,전****,5,향수향이 마음에듭니다~일단 향이 은은하네요.  마음에 들어요 ^^  좋은 향수가 저를 조금이나마 더 빛낼수 있었으면 하는 바램과 여자친구(애인)가 생길수 있기를 바라며..~!!,2020.12.29
22694,,,,,김****,5,배송빠르고 잘받앗어요배송도 정말 빠르고 포장도 꼼꼼히 잘해주셧구요무엇보다도 하나가격에 두개를 받아서 좋아요^^향도 깔끔하고 너무좋내요 감사합니다!,2020.12.29
22688,,,,,조****,5,"인생향수 강추!!저는 평소 펜**리*스, 산타**프리지아 유명향수를 사용하는대조여정씨나오는 드라마에서 아프리모를(핫스터프) 우연히 알게되어반신반의하며  바로 구매해보았어요12월22일구매하고 23일어제  배송 받았어욥핫스터프는 은은한 향을 좋아하는 제게는 다소 강하지만잔향이 좋더라구요큰기대없이 이벤트로 구매한 오리지널을 시향하고 반해버려서바로 2차구매하엿답니다롯데쇼핑몰에서 이벤트가 진행되어 구매완료한  산타**프리지아는 구매취소 하엿구요이벤트의 아쉬움에 오늘 3차구매 도전!!매일 아프리모를 구매하고있는 저랍니다저의 인생향수 아프리모로 변신!!너무너무 강추드려욧!!!",2020.12.24
17415,,,,,미****,5,향이 좋습니다~더 바디 향수오~~ 이 향 모지? 너무 좋은데? ㅎㅎ향수를 처음 써보는데은은하게 퍼지는 향이 좋습니다.크리스마스를 앞두고신랑에게도 선물했는데..향 맡아보더니 맘에 든다네요 ㅎㅎ앞으로 애정할래요~,2020.12.24
17425,,,,,이****,5,향이 잔잔하니 좋습니다은은하니 주변 지인들이 좋다고 말해주는 향수에요!,2020.12.23
17432,,,,,이****,5,"제 기준에서 최고좋은 향입니다.요즘 행사제품 많아서 벌써 이번 달만 세번째 지름이에요.더바디는 샘플로 접하구선... ""어...  이거뭐야?""할 정도로 향이 딱 좋네요.신제품 라인들 포장도, 용기 디자인도 훌륭합니다.무엇보다좋은향이 오래 지속되는 오드퍼퓸이라 더 좋아요.",2020.12.21
22689,,,,,황****,5,"첫구매로 선택한 향:)신랑 향수로 첫 구매했어요^^오리지널 구매하러 왔다가 더바디랑 같이 구매해서 행사가 추가구매로 저렴하게 득템했어요~처음 이용하는 브랜드라 샘플향 부터 시향해봤어요~첫향은 맡아본듯한 향이였는데, 시원하고 상쾌한? 느낌의 향이였어요~시간 지나고 맡아도 향이 많이 옅어지지않고, 좋은향이 계속 유지되더라구요~개인적으론 겨울보다는 봄,여름에 쓰면 좋을것같아요~더바디는 먼저 쓰고, 다 쓰면 오리지널 쓰려구요~첫구매라 고민하다 구매했는데, 향수 두개에 할인쿠폰까지 사용하니 착한가격에 좋은향수 득템했네요^^배송도 주말에 구매했는데, 서울이라 퀵배송으로 빠르게 받아볼수있었어요~잘 사용하겠습니다^^",2020.12.21
17434,,,,,황****,5,"아프리모 첫 구매예요:)신랑 향수로 첫 구매했어요^^오리지널 구매하러 왔다가 오리지널은 행사가 추가구매로 저렴하게 득템하고, 추천향수 검색해서 더바디도 구매했어요^^처음 이용하는 브랜드라 샘플향 부터 시향해봤어요~첫향은 좀 강한가? 해서 교환해야하나 싶었는데, 시간 지나고 맡아보니 은은한게 자연스럽고 예쁜?향 이네요ㅎㅎ달달하면서 은은한 향이라 거부감 없이 좋아요~첫구매라 고민하다 구매했는데, 향수 두개에 할인쿠폰까지 사용하니 착한가격에 좋은향수 득템했네요^^배송도 주말에 구매했는데, 서울이라 퀵배송으로 빠르게 받아볼수있었어요~잘 사용하겠습니다^^",2020.12.21
17437,,,,,김****,5,잘받았습니다배송 빨리오구 냄새도 잠깐 맡아보기만했는데 좋은거같아요,2020.12.20
22690,,,,,김****,5,최애향수!!!!지속력도 강하고 넘조아여!선물했는데 좋아해요!!!용기도 이쁘고 이번에  행사까지!자주애용할게요!!,2020.12.19
17450,,,,,김****,5,작년부터 지금까지 써온 향수입니다.남자 향수치고는 부드럽고 달달한 향을 좋아해 4계절 꾸준히 애용중입니다!! 이런 향을 만들어주신 아프리모 넘 감사해요!!,2020.12.18
17359,,,,,노****,5,역시 좋아용아프리모 향수 이전에도 썼었는데 박스도 넘 깔끔하게 이쁘게 주시고 향은 역시 달달해서 좋네요 추천합니다~~!,2020.12.16
22685,,,,,송****,5,리뷰최근 본 상품 구입시 하나를 90%할인된 가격에 더 준다는 알림을 받고 지인에게 선물해주기 위해 구입하게 되었습니다월요일 저녁에 주문하여 목요일에 도착했습니다그리 빠르진 않지만 보통의 배송기간 인거 같습니다예전에 3종셋트 구입후 잘 사용중이고 이번에 이벤트 알림으로 지인에게 선물할수 있게 되어 좋은 기회였다고 생각됩니다,2020.12.16
17366,,,,,남****,5,상품 잘 받앗습니다.  향이 진하지가 않아서  좋아요.  샘플도 2개나 챙겨주셔서 감사합니다,2020.12.15
26009,,,,,윤****,5,정말 맘에 딱 드는 향수 찿았습니다~~여러메이커들도 많고 향수들도 많지만 뭔가 한가지씩 아쉬운점이 있었는데 우연히 아프리모 광고 보고 궁금증에 오리지널을 구입해봤어요~~솔직히 하나는 행사가격에 주시잖아요~그래서  아~~샀다가 향이 저렴이향나서 폭망하는거 아닌가 싶었어요~~~제품도착해서 뜯었는데 왼걸~~~~향이 너~무좋은거에요~~다른것들도 괜찮겠다 싶어 바주문한게 이 더바디제품이에요~~이거 제 단짝 향수가될듯해요~~시향해봤는데 정말 이런향이었음 좋겠다 생각했던게 바로 이향이에요~~암튼 너무너무 잘사고 기분도좋고~~~~ㅋ 이번 온라인쇼핑은 성공이네요~~ㅎㅎ,2020.12.15
17375,,,,,주****,5,향에 취해~~오리지날 향수를 구입해 따라온 더바디 향수 샘플을 써보니 구매를 안할수가 없어서 또 질렀네요 ㅎㅎ향이 왜이리 좋은지 그렇다고 다 구입하기엔 땡전압박이 ㅋㅋ자꾸 구입하게 만드는 향이네요~~,2020.12.13
22686,,,,,노****,5,아프리모 남성 향수향은 스킨향 느낌입니다만  #ckfree 켈빈클라인 프리 처럼 스킨 향 인데요 향수 뿌리고 나서 좀 지나면 #아프리모 #남성향수 가 향이 더 산뜻한것 같습니다개인적으로  CK FREE 향수보다 #아프리모향수 가 더 좋은것 같습니다,2020.12.11
17394,,,,,김****,5,냄시 짱좋아요처음엔 살짝 짙은향기라 좀그랬는데 한 30분 지나고선 향기가 미쳤어요,2020.12.9
22682,,,,,이****,5,남자꺼도 좋네용ㅋㅋㅋ조아요조아요 ~~~~~~~ 굿굿,2020.12.7
17307,,,,,김****,5,좋아요잘쓰겠습니다~^^,2020.12.7
17308,,,,,장****,5,좋다네용!동생생일선물로샀습니다향이너무좋다고난리나겠는걸? 이럽니닼ㅋㅋ좋더라구요다음엔애인선물해줘야겠어요ㅋ,2020.12.6
22683,,,,,주****,5,처음 사용하는데 향이 엄청 좋네요,2020.12.4
22684,,,,,권****,5,제구입^^제구입해요~주변분들이 향이 너무 좋다고들 합니다^^,2020.12.3
17336,,,,,방****,5,상품 잘 받았습니다상품 빠르게 잘 받았습니다항상 잘 쓰고 있습니다,2020.12.2
17281,,,,,최****,5,빠르게 잘 받았습니다^^예전에 아프리모제품쓴기억에 다시구매하게되었습니다^^역시 향이 오래가고 너무좋아요^^완전 강추!!다음번엔 다른향도 주문해봐야겠어요^^,2020.11.24
17299,,,,,김****,5,더 바디오늘 점심식사 후에 주문했는데  저녁에 도착했습니다너무 빠른 배송에 놀람아직 사용하지는 않았지만 자주 이용할듯 합니다 ^^,2020.11.18
17245,,,,,이****,5,크ㅠ 제가 좋아하는 향이에요남친한테 선물햇더니 좋아하네여 ㅋㅋ,2020.11.11
17182,,,,,장****,5,오래가서 좋아요더바디 새로 나온것 같아서 구매했는데 좋아요.역시 아프리모 걱정없이 구매하게 하네요.향도 좋은데 오래가서 더 좋아요.굿굿,2020.11.6
17184,,,,,김****,5,배송 빠르고 향도 좋네요같이 보내주신 샘플 감사합니다,2020.11.5
17202,,,,,강****,5,추천합니다정말 좋아요 추천합니다,2020.11.3
17108,,,,,강****,5,더바디 오리지널와~향 너무 좋습니다.기대 되네요,2020.10.15
17039,,,,,권****,5,비누보단바디 오일향??약간 아르간 오일 느낌도 남,2020.10.8
17051,,,,,노****,5,"다른 제품 쓰다가 더바디 처음으로 구매해봅니다!핫스터프, 미드나잇, 로맨틱, 오리지널 등 쓰다가처음으로 더바디 제품 사봅니다.샘플을 뿌려보니? 어머 이건 내 스타일 아닌가요.(그래도 로맨틱이 난 좋아..)시원한 매력이 좔좔~ 더바디 처음 사보는데 향이 너무 좋아요.다른 제품도 다 좋으니 안써보신분들은 한번씩 써보는 것도 나쁘진 않을 거예요!",2020.10.7
22681,,,,,권****,5,Always항상 구매합니다 좋아여 이번에 쿠폰주셔서 기분좋게 구매하였습니다여러분 이거 쓰세요 정말좋아여....!앞으로 자주 애용하겠습니다 ㅎㅎ,2020.10.7
17058,,,,,방****,5,상품 잘 받았습니다.당일 배송으로 잘 받았습니다.,2020.10.7
17060,,,,,방****,5,상품 잘 받았습니다.당일 배송이라 더 좋네요.,2020.10.7
17064,,,,,김****,5,빠르게 잘 배송받았습니다. :D퇴근후에 받아서 아직 사용은 안해봤네요.사용해보고 괜찮음. 추가구매해보려구요.포장도 고급스럽고 선물하기도 좋을거같네요.,2020.10.6
17065,,,,,강****,5,데일리로 딱이야!데일리로 딱인 가벼우면서도 은은한 향이 캐주얼하게도 잘 어울려요. 신랑 선물했는데 좋아하네요.,2020.10.6
17091,,,,,이****,5,항상 애용하는 제품입니다항상 잘 쓰고 제일 좋아하는 향수입니다,2020.9.30
17093,,,,,이****,5,좋아요냄새 좋네요 ^^,2020.9.29
17096,,,,,장****,5,k0436굿굿 냄새도 강하지 않고 좋아요~~,2020.9.29
26008,,,,,이****,5,생전 처음 향수샀는데 좋아요 ㅎㅎ태어나서 첨 향수사봤는데 괜찮더라구요 ㅎㅎㅎ배송도 엄청빠르게와서...당황했어요샘플에 포장도 깔끔하고 굿입니다 굿굿굿많이파세요~,2020.9.28
16965,,,,,0****,5,역시 아프리모입니다!!아프리모 향수 뿌리고 효과봐서 더바디 향수도 구입합니다 좋은 향수 감사해여~~,2020.9.17
22679,,,,,배****,5,아프리모 오드퍼퓸냄새도 은은하고 향기도 좋고 지속도도 오래 남아서 너무 좋습니다,2020.9.10
17000,,,,,건****,5,"두 번째는 이 제품으로 구매를 해보았습니다.남성용 아프리모 향수를 이용하고, 이 향수를 샀습니다.퇴근하고 향수를 뿌리고 냄새를 맡자마자처음에는 거칠었지만 알 수록 따뜻하게 보이는 남성의 손길이 보이면서, 그 손길로 여성을 지키는 듯이 팔을 내민게 보이더군요.후기쓰는 도중에도 은은하게 나는 향수 덕분에 피로가 사라지는듯이 마음이 편해졌어요.좋은 향수를 만들어 주셔서 감사합니다! 잘 쓸게요~",2020.9.9
16900,,,,,강****,5,오리지날 다쓰고 구매합니다오리지날 향이 좋은데 이것도 향이 좋았으면 좋겠네요,2020.9.7
16904,,,,,이****,5,배송도 빠르고 완전만족합니다일단 배송도 빠르고 향도 좋은데다다가 완전만족합니다 주변에서 냄새좋다고 난리네요 완전만족합니다,2020.9.7
16852,,,,,배****,5,아프리모 좋네요~아프리모를 좋아하면 생기는 일(사진참조),2020.8.28
16854,,,,,이****,5,향너무 좋아요감사히 잘 쓰겠습니다,2020.8.28
16858,,,,,정****,5,기분좋네요 ㅎㅎ오늘아침에 샤워하고나서 손목이랑 가슴에 뿌리고 나왔는데움직일때마다 조금씩 향이 퍼지는게 느껴지고 기분이 정말 좋습니다 ㅎㅎ옆에앉은 여직원도 좋은냄새난다면서 물어봤어요!,2020.8.28
22678,,,,,테****,5,재구매할것같은향수아프리모 향수는 흔한향이아니라서 진짜 좋은것같아요분명 부담스럽지않게 매일쓰긴좋은데 시중에 흔한향은 아닌것 같음첫향은 상큼한것같은데 그위에 은은하게 남는향이 부드럽고 오묘함 그래서 페로몬향수인가 싶기도하고정말 만족스럽고 금방다쓰고 또 살것같네요,2020.8.28
16877,,,,,최****,5,Gooooooood!선물받아서 더바디제품을 이용하였는데 주변사람들이 향이 많이 좋다고 칭찬하네요.이번엔 제가 구매해서 씁니다.다쓰고나면 샘플로온 미드나잇이랑 함께 구매하려구요.,2020.8.24
16796,,,,,방****,5,항상 잘 쓰고 있습니다너무 잘 쓰고 있습니다.주변에서 향수 뭐 쓰냐고 물어보기도 하고요빠른 배송 감사해요~,2020.8.19
16797,,,,,방****,5,상품 잘받았습니다항상 잘 쓰고 있습니다 빠른배송 감사해요~,2020.8.19
16800,,,,,신****,5,솔직후기옛날에 아프리모 골드 남자 향수 사고나서 ㄱㅊ았던 기억으로더바디 향수를 기대하며 샀습니다.근데 왠열향이 넘 비슷한.. 골드 향수에서 좀 연해진 느낌(?)색다르길 원하고 기다렸는데 그냥 같은거 산 느낌이네요..향은 좋는데 좀 더 다양화 됐으면 좋겠음,2020.8.18
26005,,,,,고****,5,시원한 비누향기사계절내내 사용해도 좋을향이네요어떻게보면 엄청 흔한향이기도ㅎㅎㅎㅎ,2020.8.18
22677,,,,,권****,5,구매..다른 사이트에서 구입하다이번부터 처음으로 홈피에서 구입해서사용하네요..ㅡㅡ앞으로 홈피사용 하겠습니다.ㅡㅋ,2020.8.17
26006,,,,,호****,5,완전 최고예요~~만족도 극상!!이번에 기념일 선물로 커플로 구매했는데 여친도 향 좋다고 너무 좋아해서뿌듯하더라고요.제껏도 향 좋아서 기분좋게 아침마다 쓰고 있네요~:),2020.8.13
16828,,,,,b****,5,"짱이네요 ㅋㅋㅋㅋ은은하고 좋긴한데요, 뭔가 시중에 있던 향수에서는 느낄 수 없는 향이예요!약간 톡쏘는 상큼한 향이긴 하면서도 금세 부드러워지고요 잔향 good~중성적인 향수 같아서 여자분들이 사용해도 괜찮을듯?!영업하는 사람인데 도움이 많이 될 것 같구요아무튼 대만족입니다!서울지역은 바로 받을 수 있다는것도 마음에 듭니다.ㅋㅋㅋ출근길에 시키면서 거래처 들렀다 오니 회사에 도착해있음  ㅋㅋㅋㅋㅋㅋ",2020.8.10
16829,,,,,m****,5,직장 동료들이 다 물어봐요 ㅋㅋㅋ솔직히 광고 보고 산 거지만향이 좋을지는 그렇게 기대하지는 않았었거든요...근데 오늘 사무실에 향수가 도착해서 바로 뿌렸더니 지나가는 직원분들이 다 향수 어떤 거 쓰냐고 물어보시더라구요.. 뿌듯후기처럼 약간 샤워 후 그 살냄새가 나서 너무 좋아요은은하고남자향수인데 진하지 않고 은은해서 좋은것 같네요원래 향수에 돈 안쓰는데 진짜 만족합니다감사합니다.!!!,2020.8.10
16830,,,,,j****,5,중독성있는 아프리모..벌써 여러 종류를 사용해보았네요^^이번에는 할인하는 더 바디!!! 시간이 지날수록더 은은하게 향이 지속되어서 좋습니다~~ 막 샤워한듯한 느낌 ㅎㅎ원래 오리지날이랑 핫스터프를 사용하다가그 다음에 오리지날과 골드를 사용했는데전체적으로 스타일에 따라 맞는 향을 사용하니다음번에는 아직 사용안한 제품을 또 구매해야겠습니다^^,2020.8.10
16832,,,,,나****,5,이것도 완전 향이 좋잖아!!!1향이 대박입니다.재구매 의사 당근 있습니다.,2020.8.10
26007,,,,,좋****,5,남친이 좋다고 하네요~평이 좋아서 구매했는데 남친도 좋다고 하네요~좋아요♡,2020.8.10
26001,,,,,조****,5,진짜 인생 향수ㅠㅠ향수를 너무 좋아해서 여러종류의 향수를 사용했지만 이 향수는 진짜 인생 향수에요ㅠㅠ 향도 너무 좋고 잔향마저 좋아요! 다 쓰면 또 사고싶을만큼 너무 좋네요ㅎㅎ,2020.8.9
16714,,,,,박****,5,사람들이 진짜 물어보네ㅋ이향수 완전추천 대박추천이제야 알고 사용했다는게 아쉬울뿐이네요ㅋ이거뿌리고 나서 정말 향수 뿌렸냐는 얘기 몇번이나 들었어요다른사람들이 후기로 말할땐 뻥이라고생각했는데 막상 내가 들으니너무 신기하더라구요,2020.8.7
16723,,,,,n****,5,빠른 배송 제품만족함크기가 크지 않아서 들고다니면서 쓰기도 좋고 사무실에 올려 놓고 사용중이에요 제품은 괜찮아요,2020.8.7
16728,,,,,i****,5,잘쓰고있어여~오랜만에 마음에 드는 향수 알게되어 기분이 좋네요 오래오래 쓸게요 감사합니다,2020.8.7
26002,,,,,w****,5,좋아요@와이프 선물로 사줬는데 향좋다고잘쓰겠다고 하네요 굳굳@,2020.8.7
16737,,,,,박****,5,정말 호불호가 없는 향수제가 다양한 향수를 써왔지만 이 더바디 제품은 호불호가 없는 누구나가 매력을 느낄 수 있는 향이라 너무 좋습니다.진짜 향에 엄청 민감한 편인데도 포근하면서 비누향 비슷한데 나중에 시간이 지나면 상큼한 향이 남는 느낌에 감탄만 나옵니다.제가 좀 동안이라 저한테는 정말 너무 이미지가 매칭되는 향이네요.제 착각일 수도 있지만 지나가는 여성이 뒤돌아 볼 정도나 눈을 마주치는 경우가 있길 바랄뿐입니다. 하하하그만큼 이 더바디의 향이 이성에게 매력적인 향이라는걸 느낄 수 있었습니다. 너무 좋아요♡♡♡,2020.8.6
26003,,,,,빠****,5,빠른배송 좋네요~향수 잘 받았습니다.배송 빨라서 좋네요,2020.8.6
16754,,,,,김****,5,dneka1배송이 너무 빨라서 좋아요 ㅎㅎ,2020.8.4
26004,,,,,유****,5,"진짜 후기다.본인은 뭔가 구매를 할때 광고보다는 유튜브나 후기들을 조사하고 사는편이다. 근데 아프리모는 광고 느낌이 강해서 구매하지않으려다가 과거에 아프리모 로맨틱을 시향한 기억이 있어서 믿고 구매했는데, 향이 자연스럽고 뭔가 포근하다. 스킨향 아니다, 여자친구가 향수에 민감한데 되게 좋아하네 근데 막 허억허억이 아니라 습 호오 좋당 이런거다. 담에 또 사야징 (•̀ᴗ•́)و",2020.7.31
16785,,,,,유****,5,합격입니당고민하시는분들 저도 유튜브에도 검색하고 고민을 거의 3달하다가 샀는데 뭔가 스킨향은 아니고 그냥 맡으면 좋아요. 부드럽고 뭔가 자연스러워요 향이. 여자친구도 향수에 살짝 예민한편인데 좋다고하네요. :)) 넘나 좋은것 다 떨어지면 또 사야징,2020.7.31
16786,,,,,박****,5,너무좋아요배송도 빠르고 향정말좋네요~~ 인생향수라고 할만하네요~다른 항수쓰고있닥 아프리모가 요새핫해서 사보았는데정말 만족하네요 ㅎㅎ 향도 전꺼보다 오래가고향기도 훨씬좋네요 재구매의사 도있습니다~,2020.7.31
16787,,,,,9****,5,또 하나 질렀네요..도착하자마자 개봉..더바디 향수의 경우 살짝 부드럽게 감기는 향이고 깔끔하네요,2020.7.31
22676,,,,,박****,5,와 배송믿고쓰는 아프리모 향수 주문했는데몇시간안되서 배송알림뜨길래 신상털린건줄알았는데당일배송이었네요..기다릴틈없이 쓰게해주셔서 감사합니다~,2020.7.31
16627,,,,,박****,5,더바디 남자 향수  첫 구매 고객  후기안녕하세요 처음으로 이용하는 고객입니다. 아프리모 향수 광고을 아주 많이 많이 봤고요 또는 유트브 통해 한참 또 한참 고민했습니다.남성으로서 향수가 취미가 아니라서 이걸 사면 도대체 어느정도로 향 좋길래 그정도로 좋은건지 구매해보기로 결심했습니다.첫 구매후 향수 한번 뿌려봤는데요!! 향 엄첨 좋더라구요!! 구매한 보람은 있긴합니다.과연 이런걸루 대중교통 이용해보면 효과 어느정도인지벌써부터 시험해보구 싶을정도입니다. 요즘 코로나 떄문에 마스크 써서 이런거 안통할거같지만 개인적으로 맘에 듭니다.^^만일 이걸루 밖에나가서 대중교통 잘 효과 나오면 좋겠네요!! 향수 다 사용하게 되면 하나하나 다른향수 또 구매해보겠습니다.,2020.7.30
25998,,,,,향****,5,향이 너무 좋네요이번에 할인 한다고해서 큰 맘 먹고 구매했는데완정 강추예요!맘에 쏙 들어요 향이 취향 하기도 하고 시간이 지나도 오래동안 남아있는게후회 없는 결정이였던 거 같아요~ㅎㅎ,2020.7.30
16631,,,,,추****,5,항상 미드나잇만쓰다 바꿔봤는데 좋네요향이좋네요~,2020.7.30
16635,,,,,박****,5,"더바디도 좋네요^^오리지널, 더바디 같이 구매했는데,비슷하면서도 다른 매력이 있네요",2020.7.29
16638,,,,,에****,5,잔향이 오래 가네요배송 진짜 빠르네요 어제 저녁에 시켰는데 생각보다 빠르게 옴친구가 사용하는거보고 롭스에서 시향해보고 온라인에서 구매했어용향은 맡았던거라 맘에들어요,2020.7.29
25999,,,,,펭****,5,향도 좋고~배송도 완전 빨라요~ㅊㅊ오래동안 은은하게 향이 지속되는게 제일 좋네요`ㅎㅎ서울권이라고 아침에 주문했는데 오후에 도착하는 서비스도 굳굳이예요`~`,2020.7.29
16652,,,,,t****,5,매번 쓰는거지만 향이 아주좋아요마음에들고 향도 좋아요시간이 조금 지난향이 더 좋은거같네요,2020.7.28
16653,,,,,윤****,5,더바디 제품 후기온라인으로 향수 구매는 처음인데 배송 빠르게 오고 깨지거나 이런 문제 없이 왔습니다지속력도 괜찮은 듯하네요~~,2020.7.28
16654,,,,,김****,5,자연스럽게 퍼지는 향 만족스러워용~친구가 사용하는거보고 롭스에서 시향해보고 온라인에서 구매했어용!!배송빠르고 괜찮은거같아요 향은 맡았던거라 맘에들어요,2020.7.28
16659,,,,,j****,5,"향수 후기요안녕하세요. 향수 후기 남깁니다.아프리모를 자주 이용하는 고객입니다. 평소에 오리지널이 그나마 저렴해서 오리지널만 사용하다가이번 기회에 다른 향수도 써보고자 더바디를 구매했습니다.저렴한 향수는 아니기에 저랑 잘 맞지 않을까 걱정했는데 다행히 마음에 들어 사용하기로 했습니다.일단 케이스가 다른 향수들과 다르게 디자인적으로 이쁘기도하고, 향수 포장을 개봉하면 책자? 같은게 있습니다.평소에 인테리어에 관심이 많은데 인테리어 소품으로도 적합하더라구요.향도 제가 부담스러운 향은 꺼려하는데 부담스럽지 않고 아프리모 특유의 머스크향이 잘 담겨있는것 같습니다.두서없이 작성해서 죄송합니다. 아무튼 개인적으로 저는 별 5개중에 4개 반? 정도 부여하고 싶네요. 감사합니다.",2020.7.27
16661,,,,,호****,5,향수 겟 ㅋㅋㅋ여름이라서 땀때문에 안좋으 냄새날까바 향수 찾다가 와봤는데이름부터 뭔가 바디클린저 느낌이 나서 구매함요!일단 맘에드는점 첫번째 뿌릴때 느낌이 굿! 슈슈슈슛하면서 부드럽게 퍼지는데 이걸 뭐라 설명할지...그리고 향은!!! 비누향? 이라고해야하나요 샤워할때 따뜻한 공기에서 나는 냄새 비슷한게 나는데 저한테는 잘 맞는거 같습니다~!일단 다 써보고 또 말씀드릴게용! 수고하십쇼ㅎㅎ,2020.7.27
