review_uid,product_name,product_price,product_type,username_1,username_2,rating,review_content,review_date
64348,,,,,박****,5,언제나 항상 아프리모 더비디를 사용하는 사람입니다 이제는 주변 사람들이 더바디의 향을 제 냄새라고 부르고 언제나 좋은 향이 난다고 항상 칭찬해주고 있습니다 혹시 향에 대한 걱정 때문에 구매를 망서리신다면 그럴 필요 없습니다 바로 구매하세요 절때 후회하지 않으실겁니다^^,2024.4.16
64344,,,,,탁****,5,벌써 몇년째 이용중이지만 실망한작이없는제품이네요~^^,2024.4.15
64322,,,,,태****,5,좋아요 아주 좋은 향수입니다.또 구매할께요,2024.4.13
64321,,,,,김****,5,처음써본게 엊그제 같은데 어느샌가 계속 구매하게 되네요 주변에서도 향이 괜찮다해서 그런점도 있고 핸드크림은 처음 사봤는데 역시나 실망하진 않네요,2024.4.13
64319,,,,,강****,5,은은한 남자 살 냄새가 오래 갔으면 좋겠습니다기존 오리지널.보다 지속력이 좀 아쉬운거 같습니다,2024.4.12
64311,,,,,전****,5,배송빠르고 좋아요향도 맘에드네요,2024.4.12
64303,,,,,이****,5,남자향수를 여러가지 써봤지만 마땅치않고 다 그저그랬는데 괜찮은 향수다 하는 후기 좋은 제품들 사보고 써보고 다해봤지만 아프리모도 후기만좋고 별거없겠지 하고 써봤는데 첫날 둘째날 계속 쓰다보니 중독되는 향수인거같아요 냄새가 여자향수냄새같은데? 하면서 첫향만셀뿐 잔잔하게 스며드는 뒷향이 너무 중독적인거같아요 이 향수쓰고나서부터 어디 향수냐고 물어보는 사람들이 많았어요 정말 매력적인 향 이라서 앞으로도 계속 재구매 할 예정입니다,2024.4.11
64291,,,,,김****,5,"""한 가한 주말에 편집샵 돌다가 좋은 향 맡을 때의 기분을 느끼게 해주는 향이다""제 여사친 입에서 이런 말이 나올 줄이야정말 처음에는 오그라들고 놀랐는데시간이 지나도 머리 속에 멤돌면서 은근 기분이 좋더라구요ㅎㅎ그 이후로 더바디를 뿌릴 때 마다 뭔가 편안하고 즐거운 기분이 들어서벌써 3병 째 사용하는 중이에요살짝 파우더리한 첫 향이 상당히 포근함을 주는데 또 잔잔히 깔리는 머스크향이 향에 풍부함을 줘서 질리지 않는 향이에요. 물론 직접 맡아 보는 걸 추천 드리긴 합니다.이 향수는 어떤 향이라고 글만으로 표현하기엔 한계가 있거든요..일상에 포인트를 가져다 주는 향수, 저는 이렇게 애칭을 붙여주고 싶네요ㅎㅎ",2024.4.9
64289,,,,,서****,5,항상 쓰느 제품입니다 여성꺼만 쓰다 너무 좋아서 남자꺼도 같이 사서 신랑이랑 같이 쓰는데핸드크림도 나왔네여 그래서 요것도 구매향이 좋네요 잘 쓸듯 합니다.,2024.4.9
64286,,,,,오****,5,반신반의로 고민하고 구매했는데 걱정한 시간이 아깝네요 과하지않고 세련되며 따뜻한? 안락한 냄새입니다 지속력체크해보고 이걸로 갈아타야겠네요 앞으로 아프리모와의 여정이 기대되네요ㅎ,2024.4.8
64283,,,,,강****,5,향이 너무 좋아요! 재 구매 의향 100%%,2024.4.8
64282,,,,,강****,5,23번 구했어요 향이 너무 좋네요!,2024.4.8
64278,,,,,민****,5,향이 생각보다 너무 좋아요 재구매의사 있습니다,2024.4.7
64274,,,,,유****,5,주위에서 추천받고 처응으로 사용해 봤습니다 향이  찐하지도 않고 은은한게 무리없이 사용할 수 있어 좋았습니다 다른 사람들한테도 추천하고 싶은 상품이네요~^^  앞으로 계속 아프리모 더바디 향수를 사용하고잦삽니다~  제 리뷰 보시는 분들 한번만 사용해 보세요 후회하지  않고 저처럼  팬이 되 있을겁니다~  이 향수를  쓰고나서 외출할때 자신감도 생겨답니다^^  강력 추천합니다 ~,2024.4.7
64256,,,,,서****,5,원래 자주 애용하던 오리지널 향수가 단종되고ㅠㅠ정착한 더 바디 향수!새로운 향수라 향이 괜찮을까? 걱정이 많이 됐는데걱정과는 달리 더 바디 향수의 향에 매료돼서헤어나오지 못하는 중이에요ㅎㅎ첫 향은 상큼하고 싱그러운 향이나고중간 향은 마음이 진정되는 새벽의 향기가 나고끝 향은 막 씻고 나왔을때의 포근한 향이 나요!!!더 바디 향수는 첫 향에 알코올 냄새가 많이 안나서뿌릴 때 부터 기분이 좋아져서 하루의 시작을 기분좋게시작 할 수 있어요~~~향수를 뭐살지 고민하시는 분들이나포근하고 자연스러운 향을 원하시는 분들은더 바디 향수를 써보시면 후회 안 할 것 같아요!다들 더 바디 향수 쓰시고 하루를 기분좋게 시작해봐요~~~ㅎ,2024.4.5
64250,,,,,김****,5,"30대 평범한 직장인입니다. 남자는 잘 씼고, 단정하게만 입어도 생각보다 좋은 이미지를 줄 수 있다고 생각하며 살았는데, 좋은 향이 더해지면 더 강력한 인상을 줄 수 있다는 걸 더바디를 통해 알게 됬어요. 더바디는 여자친구 한테 선물 받아 쓰기 시작했는데, 향이 너무 좋아서 추가로 구매 했습니다. 향수는 비싼게 좋다는 생각에 매 번 백화점에 가서 큰맘먹고 20-30만원 대 샀는데향이 너무 세서 호불호가 많이 갈린달까요, 그리고 마음껏 뿌리기도 어렵고요..더바디는 백화점 향수 못지 않은 풍부한 향과 지속력 때문에 마음에 들었고, 코를 찌르지 않는 은은한 향이라 더 좋았습니다. 더바디로 스타일링을 마무리 하면 지인들이 좋은 향 난다고 칭찬 한 마디씩 해주더라구요. 안 뿌린 날 보다 좋은 눈길을 많이 받는 것 같아서 그날 미팅이나 회의가 있는 날이면 조금 더 좋은 결과를 얻을 수 있는 것같아요. 요즘은 더바디를 뿌리는게 저만의 의식이 된 것 같아요앞으로도 꾸준히 사용 할 예정이라 또 다시 오겠습니다ㅎㅎ",2024.4.5
64248,,,,,최****,5,인터넷 상에서 좋은 후기가 많아 금번 아프리모 향수를 구입하게 되었습니다.먼저 주문 담날 배송된 점이 맘에 들었구요~제품 포장도 너무 꼼꼼히 잘 되어 있어 믿음이 가네요~용기 디자인도 너무 맘에 들구요~무엇보다 부드럽고 포근한 향기가 젤 좋은거 같습니다. 매일매일 즐겁게 사용할꺼 같네요~앞으로도 좋은상품 마니마니 파시길요^^,2024.4.5
64246,,,,,홍****,5,최근에 샘플로 받아보고 향이 좋아 미드나잇과 함께 구매해서 사용중인 더바디 향수 방금 씻고 난듯한 냄새에 향도 좋습니다. 미드나잇과 더바디를 번갈아가며 사용중인데 요번에 향수로 여자분이 호기심가지시다가 결국 제 여자친구가 되었습니다. 지속적으로 사용한 보람이 있네요,2024.4.5
64236,,,,,박****,5,믿고 쓰는 향수여서재구매 했어요~역시 은은하게 나는 향이고급스럽고 편안함을 주는향이네요!!나중에 재구매 각입니다!!!👍,2024.4.4
64232,,,,,김****,5,계절이 바뀌면서 아프리모 향수 새로 샀는데주변에서도 거부감없이 다 좋다고 해서 뿌듯요즘 나갈때마다 뿌리는데 잔향 좋아서완전 취저당함 ㅠㅠ 근데 나만 취저 당한게 아니지 뭐야...두근두근 완전 설렌다,2024.4.3
64229,,,,,나****,5,"남자친구가 향수를 평소에 쓰지는 않는데 발렌타인 기념 선물로 줬어요.기분내고 싶은날 뿌리라고는 했지만 이왕이면 데이트 할 때 남친한테서 좋은 향이 났으면 하는 저의 욕심? 욕망? 뭐 그런것도 있었죠, 선물준 사람 보람있게 만날 때 마다 이뿌게 뿌리고오는 남친이 요즘 더 이쁘게 느껴지더라구요,역시 사람은 외적인 모습과 향기를 무시 할 수 없는 것 같아요.생각보다 양 조절을 못해서 많이 많이 뿌리는데, 향수가 막 코 속을 쑤시는 자극적인 향이 아니라 은은하게 풍기는 매력적인 향이고 계속 맡아도 어지럽지 않은 은은하지만 강한 잔향이 있어서 부담스럽지 않네요. 더바디가 시그니쳐라 제일 좋긴 한데, 이거 다쓰면 다른 것도 사주려구요벌써 무슨 향이 어울릴까 즐거운 고민을 합니다😊",2024.4.3
64222,,,,,김****,5,예전부터 아프리모 향수를 구매를 하고싶었는데 깜빡 잊어버리고 있다.최근에 향수를 사야겠다싶어서 망설임 1도없이 아프리모향수를 구매를 하게됬습니다. 무엇보다 지금 할인행사 중이라 원가보다 더 저렴하게 구매를 하엿고 무엇보다 기대이상만큼 향이 매우 좋더라구요ㅋㅋ제가 지나가다 사람들 향수냄새나 화장품냄새나면 좀기피하다싶이 했는데 코도워낙 민감하다보니..다만 아프리모향수는 전혀 그런게 없더라구요!!!그리고 향수를 구매하니 핸드크림은 덤!!!!특히 손이 잘트거나 그러는데 이제 더이상 그런걱정은없을것같네요ㅎㅎ향수도향수지만 핸드크림도 향수못지않게 향이 굉장히 좋아요!!!ㅋㅋ앞으로도 향수나 핸드크림은 꼭 아프리모에서 구매를 계속 쭉 해야될정도로 중독성이;;ㅋㅋ매우좋아요~~!!감사히 좋은재품 감사히 잘쓰겠습니다!!!^^,2024.4.2
64213,,,,,윤****,5,딱 팩트만 말씀드리겠습니다 ㅎㅎ 향 중독성 미쳤고그 인스타 같은데 보면 광고성으로 여자가 쳐다보고 향수뭐냐고 물어보잖아요? 이향수 뿌리고 그상황 겪었습니다ㅋㅋㅋㅋㅋ향만 좋아지는데도 이런상황이 생기다보니 자존감이 어깨빵까지 상승하네요👍,2024.3.31
64216,,,,,네****,5,매번쓰고있습니다만족해요(2024-03-30 17:25:53 에 등록된 네이버 페이 구매평),2024.3.31
64205,,,,,이****,5,제가 냄새에 민감한 편이라 그런지몰라도 다른 남성용 향수는 약간 향수특유의 독한 냄새가 느껴지고 또한 인위적인 향수냄새가 느껴지는데 다른사람이 느끼기에도 아~ 향수뿌렸구나 라고 생각할정도로 향수냄새가 납니다하지만 더바디는 주변사람들한테 냄새 좋다는 이야기를 정말 많이 듣고 또 향수냄새인지 몰랐다는 반응이 가장 많고 살냄새같단 말을 많이 듣습니다 제가 싫어하는 향수특유의 독한 냄새도 없어서 향수사용이 부담스럽지 않아서 매우 좋습니다,2024.3.30
64204,,,,,정****,5,너무 좋고 아름답습니다 ୧( “̮ )୨,2024.3.30
64211,,,,,네****,5,늘쓰는 향수 입니다 데일리로 좋아요그리고 핸트크림도 향 진짜 좋아요(2024-03-29 14:41:59 에 등록된 네이버 페이 구매평),2024.3.30
64195,,,,,노****,4,강한 향은 아니고 은은해서 좋아요.,2024.3.29
64190,,,,,네****,5,좋아요 좋아요 좋아요(2024-03-27 10:33:52 에 등록된 네이버 페이 구매평),2024.3.28
64192,,,,,네****,5,사람들이 다 뭐 쓰냐고 물어볼 정도로 냄새 좋아요(2024-03-27 09:42:02 에 등록된 네이버 페이 구매평),2024.3.28
64181,,,,,P****,5,더 바디 향수 향이 맘에 들어 자주 사용하다 보니 양도 얼마 남지 않았네요~^^,2024.3.28
64177,,,,,장****,5,운동하는 사람이라 땀을 많이 흘리다보니 냄새도 워낙 신경 쓰이이더라구요어릴 때야 저보다 더 한 애들도 많아서 그냥 그러려니 하고 살았는데성인 되고 체면 차릴 일이 많아지다 보니 자연스레 냄새에 집착아닌 집착을 하게되네요남자 향수하면 알코올향이 코를 쏘는 강한 것들만 맡아와서 생각보다 땀냄새랑 섞이면 엮한 것들 것 많았는데 이 향수는 그런거 없이 은은하게 잘 어우러져서 좋네요.물론 안 씻은 그런 상태에서는 어떤 향수를 써도 답 없겠지만씻고 넉넉히 뿌리고 나가면 샴푸 향 이랑 섞여서 기분도 더 좋고 무엇보다 여자친구가 저보다 더 좋아하는게 느껴지니까 이제 안쓸래야 안 쓸 수가 없네요,2024.3.27
64174,,,,,홍****,5,4번째 구매인듯해요향수를 한달에 한번은 구매하는편인데명품향수 외 다양한 향수 브랜드는 다 접해봤지만제겐 더바디 이제품이 매칭이 좋네요,2024.3.27
64167,,,,,민****,5,남편 선물로 사줬어요 !!!!! 첨엔 남자스킨냄새가 좀 나는데지나고나면 잔향이 미쳤습니다 ..남자친구 선물 왕추천 !!!남자분들 여자들이 조아하는 향수 비싼거 찾지 마시고이거 당장 구매하세여 !!!!,2024.3.26
64150,,,,,장****,5,은은한 향기로 타인이 좋아합니다특히 여성이 좋아합니다,2024.3.24
64146,,,,,박****,5,"아프리모 향수는 향이 참 좋은것 같아요, 사은품도 주시고 좋습니다요~~~",2024.3.23
64134,,,,,s****,5,향이 좋고 오래가고 은은하게 향이 남아있어서 좋네요 사은품도 잘 받았습니다,2024.3.22
64132,,,,,박****,5,두번째 구입인데 너무 만족합니다. 향이 은은해서 좋아요,2024.3.22
64128,,,,,안****,5,"⭐️믿고 사는 향수, 아프리모⭐️향수는 디올부터 시작해서 존바바, 페라리, 면세점 상품 등등 많이 사용해보다가 아프리모 골드 남성용 향수로 아프리모를 처음만났는데, 그 이후로 아프리모 말고는 다른 향수를 생각해본적 없어요! 다른 향수는 중고로 다 팔았어요!이번에 구매한 ""더바디 남자 향수""1. 상품배송 및 포장- 정말 예쁘고 깔끔하게 왔어요!- 향수만 시켰는데! 사은품이 이렇게 많이 올 줄이야!- 아프리모 정말 짱짱맨!2. 향기를 맡아보았습니다!- 시원하고 상큼한 느낌이 좋아요!- 과하고 쌘 느낌보다는 은은하게 맴도는 향입니다.- 씻고 나온듯한 깔끔함도 있어요!3. 사은품으로 보내주신 핸드크림!- 같은 더바디 이름을 제품이지만 향은 완전히 달라요!- 크림,로션보다는 약간 젤, 연고 같은 상품이에요!- 향수는 상큼하고 깔끔이었지만핸드크림은 포레스트(?) 느낌이에요!- 바르고 난 뒤에는 약간의 끈적임이 있어요!깔끔한 느낌을 원하는 분들은 호불로가 갈릴 듯 해요4. 향수 샘플- 와이프가 남자향수가 좋다고 해서여성향수도 사용해보라고 할 예정입니다!마음에 들면 여성용도 구매하려구요!* 향수 재구매 의향100%입니다!!  써보세요 ㅎㅎ",2024.3.21
64051,,,,,임****,5,진짜 항상 너무 좋은향기가 나요 계속 사요,2024.3.14
64034,,,,,최****,5,언제나 항상 너무도 잘 쓰고 있어요 거의 3개월에 1개반 정도 쓰는거 같아요... 좀 자주 씁니다...ㅋㅋㅋ,2024.3.12
64031,,,,,박****,5,어느새 3년 정도 사용해오고 있네요..정말.. 최고입니다👍🏻,2024.3.11
64030,,,,,김****,5,잘 사용하고 있습니다~~취향에 잘 맞네요^^ 그래서 추가구매하려구요👍,2024.3.11
64026,,,,,운****,5,너무 마음에 드는 향수 이고 저랑 잘 맞는 거 같아서 자주 애용하고 있어요.,2024.3.10
64024,,,,,김****,5,더바디 남자 향수 두번째 쓰고있습니다!많이 써본건 아니지만 여태 써본것중에 제일 향이 좋아요~,2024.3.10
64012,,,,,신****,5,처음으로 더바디 향수 써보니 향도좋고만족함니다.,2024.3.8
64011,,,,,박****,5,50을 향해가는 40대... 향수만은 30대만큼 소화해낸다. 지지않아 ㅡ.ㅡ+,2024.3.8
64010,,,,,d****,5,완전 너무좋아요 대박나세요 번창하세요,2024.3.8
64007,,,,,박****,5,가격도 좋고 향도 너무좋네요 재구매하러 올께유~~,2024.3.7
64003,,,,,민****,5,여자꺼만 사용해 봤는데남자향수도 좋다고 해서구매했어요 . 남자특유의 그향이 조금은 나지만 중간중간 그향이 사라지면서 향이 독특라거맘에들어요특히 남자향수핸드로션 너무 너무.좋아요 딱 원하던 향이예요 남자향수마지막에 나는 향이 나서 좋아요 ㅎㅎ 핸드크림사러 다시올거예요,2024.3.7
63998,,,,,김****,5,지난번 구매해서 사용해보고 너무 맘에 들어서 이번에 또 구매했네요. 배송 빠르고 매우 만족합니다. 감사합니다.,2024.3.6
63995,,,,,윤****,5,40대입니다~^^  친구가 오랫동안 쓰고 선물받아 계속 여기것만 선물받아 썼었었는데. 제가 사는건 처음 구매하봐요그래서 후기도 처음 써보내요전에 클래식을. 썼을때도 너무 좋았고 더바디도 너무 좋아요제 살냄새같으면서 너무 자극적이지않고 산뜻하면서 계속 맡고싶은냄새 주변 지인들도 계속 물어보고 많이들 사신거 같더라구요그래서 이번 지인들 생선도 더바디로 선물했어요~~^^진짜 너무 좋은 향 그리고 사람마다 같은 향인데도 다르게 느껴져요그래서 더 좋은거같아요~~^^♡,2024.3.6
63994,,,,,김****,5,향도 은은하고 지속력이 좋아요. 배송이 빨라서 더 좋았어요!,2024.3.6
64000,,,,,네****,5,남편이 쓰는 향수. 요것만 쓰네요.(2024-03-05 23:43:08 에 등록된 네이버 페이 구매평),2024.3.6
63990,,,,,네****,4,은은하게 지속력이 좋아요^^ 굿(2024-03-03 15:58:22 에 등록된 네이버 페이 구매평),2024.3.4
63972,,,,,♡****,5,저희 오빠는 이 향수만 꾸준히 사용하구 있어요~~~향이 좋아요~~~^^,2024.3.1
63966,,,,,유****,5,이 향수 써보니 확실히 향이 좋고주변 남성 여성 모두 많이 좋아합니다.느낌은 살냄새향이라 은은하고 독하지도 않으며맡았을때 코끝이 찡한 냄새도 아니고계속 쓰고 싶은 향이 나는 향수입니다.다만 가격대가 좀 저렴했으면 하는아쉬움이남습니다...,2024.2.29
63959,,,,,김****,5,더 바디 여자 향수 써 보고 매우 만족하여 곧 돌아오는 아들 생일 선물로 남자 향수 구입했습니다 사은품으로 보내 주신 샘플 향 맡아보니 이것도 좋아요 아들도 맘에 들어 했으면 좋겠어요,2024.2.29
63970,,,,,네****,5,전 몇년전부터 이것만 씁니다.(2024-02-28 13:47:02 에 등록된 네이버 페이 구매평),2024.2.29
63951,,,,,이****,5,아들과 같이 사용하는 50대 엄마데요..나이가 들다보니 남성향수가 좋아 (아들향수 살짝 뿌려보니) 자꾸 구입하게되네요...계속 구입할것같아요..향이 너무 맘에 드네요.번창하시고 새해복많이 받으세요 감사합니다.,2024.2.28
63938,,,,,박****,5,강추👍🏻👍🏻 더바디쓰고 상항 사람들한테 냄새 좋다고 무슨향수쓰냐고 질문받습니다 강략추천힙니다!!,2024.2.27
63944,,,,,네****,5,맘에듭니다 향이좋아요(2024-02-26 13:48:22 에 등록된 네이버 페이 구매평),2024.2.27
63936,,,,,김****,5,남성 향수이긴 하지만 두 딸과 함께 쓰려고 주문했어요. 딸 둘이 좋아하는 성향이 달라서 남성 여성 두가지 시켜본건데 기가막히게 한명씩 남성 여성으로 나뉘네요^^ 이 향수는 처음에는 남성향수 같은 느낌이 들지만 시간이 지날수록 매력이 진해지는 향수입니다. 뿌리고 출근하면 시간이 흐른 후 저한테서는 항상 좋은 향기가 난다는 얘기를 많이 들었어요. 그래서 첨에 좀 진하더라도 많이 뿌리고 출근해요. 지금은 다 써서 다시 구매하려고 합니다!!!,2024.2.26
63935,,,,,편****,5,모든게 마음에 들어오 꾸준히 재구매합니다,2024.2.26
63934,,,,,홍****,5,"[늘 행복한 향기를 지니고 다녀서인지..좋은 일이 많이 생겼습니다.]아침 일찍 일어나 잠이 덜 깬 눈을 비비며 현관 문을 나설때면 'The body' 향수가마치""오늘도 좋은 일만 있을거야!""라고 말해주는것 같습니다.그래서 저에게 'The body'는 단순한 향수라기보다는 하루를 시작하는 응원이자 주문과도 같은 그런 존재로 느껴집니다~덕분에 좋은 곳에서 식사도 하고 즐거운 시간을 보냈습니다^^감사합니다.p.s. 리뷰 당청되어 좋은 선물을 받았습니다. 감사한 마음에 사용 후기  남깁니다.'The body'와 함께 할 지금 이 순간과 내일이 기대됩니다^^",2024.2.26
63932,,,,,주****,5,매일 뿌려도 너무 좋은 향기라 구매한거 금방 사용할꺼 같아서 다쓰고 재구매 하겠습니다;),2024.2.25
63931,,,,,장****,5,1시반 이후에 주문해서 택배로 다음날 받았어요. 퀵도 좋은데 택배도 하루만에 오니 좋아요. 항상 믿고 쓰는 향수고 혜택이 많아 조금이라도 저렴허게 살 수 있어 좋아요. 디 쓰면 또 올께요. 감사합니다.,2024.2.25
63929,,,,,네****,5,매번구입하는 향이지만 용량이 아쉬워요... 더 큰걸로 만들어주세요.^^(2024-02-23 08:29:55 에 등록된 네이버 페이 구매평),2024.2.24
63917,,,,,이****,5,아들 최애 향수데요.엄마인 제가 몰래몰래 사용하다 이젠 엄마가 더바디향수 팬이 되었네요..단골입니다.향수가 참 맘에 드네요.감사합니다.자주 이용할께요.,2024.2.23
63916,,,,,박****,5,매력적인향 이거 뿌리고 여친만들러갑니다!!!,2024.2.23
63915,,,,,박****,5,요몇일 새로운 사람 만날일이 많았는데 언제나처럼 향 좋다는 소리를 들었습니다 사람의 기분까지 좋아지게하는 향수👍🏻👍🏻👍🏻👍🏻👍🏻👍🏻,2024.2.23
63913,,,,,장****,5,항상 믿고 사는 향수에요.꽤 오래쓰고 지속력도 좋고 잘 쓰고 있어요.주위 사람들도 향기 좋다고 칭찬해주시네요.감사합니다. 복 많이 받으세요.,2024.2.23
63885,,,,,네****,5,냄새가 제 스타일입니다(2024-02-18 21:38:27 에 등록된 네이버 페이 구매평),2024.2.19
63877,,,,,박****,5,제가 사용하는 향 맡더니 너무 좋아해서친구 생일선물로 줬습니다 ㅎㅎ향도 너무 좋고 특히 여자들이 좋아하는 향이라 훨씬 좋아하더라구요ㅎㅎ 여자들에게 인기 많아지고 싶으시다면 추천합니당,2024.2.18
63874,,,,,네****,5,향이 너무 좋고 자극적이지 않아서 좋습니다(2024-02-16 11:40:13 에 등록된 네이버 페이 구매평),2024.2.17
63859,,,,,네****,5,냄새 좋아여 매일뿌리고다니네요(2024-02-15 23:57:53 에 등록된 네이버 페이 구매평),2024.2.16
63850,,,,,공****,5,달콤하고 부드러운 비누향이 나서 기분좋아요!아프리모만 10년째 사용중입니다.,2024.2.15
63848,,,,,김****,5,인생향수 등극입니다 ㅎㅎ 향이 정말 좋아서 뿌리기 아까울정도로 조금씩 쓰다가 6개월동안 충분히 만끽하며 다 썼네용 ㅠㅠ향수를 워낙 좋아하다보니 브랜드향수부터 유명한 향수들 100종을 넘게 써봤지만 아프리모 더바디 만큼 깔끔하고 부드러운 향은 잘 없는거 같아요 질리지도 않구 잔향도 좋은데 지속력도 8시간 이상은 가구 특히 여자친구가 엄청 좋아해서 ㅋㅋ 잘썼습니다 또 구매 할겁니당!! 아프리모 홧팅,2024.2.15
63843,,,,,네****,5,아침에뿌리고가면 오후3시정도까지는 유지하는듯첫향보다 중간향이 더 좋아오(2024-02-13 08:15:40 에 등록된 네이버 페이 구매평),2024.2.14
63826,,,,,김****,5,지속력이 생각보다 진짜 좋네요 향 자체가 강한 느낌이 아니라서 지속력도 짧을거라고 생각했는데 오전에 뿌린 향이 밤까지 남아있어서 놀랐어요,2024.2.13
63825,,,,,박****,5,향이 깔끔하고 좋아요 ㅎㅎ향수는 이제품만 써요 ㅎㅎ,2024.2.13
63823,,,,,임****,5,대용량 버전 한정으로라도 만들어야한다!! 너무좋다!!!,2024.2.13
63822,,,,,네****,5,회사 동생 추천으로구매 하게 됐는데 처음엔 음 뭐지했다가 향의 중독성이 너무 좋네요~(2024-02-11 11:12:38 에 등록된 네이버 페이 구매평),2024.2.12
63799,,,,,김****,5,항상 잘 사용하고 있어요!!!  데일리 향수로 이만한게 없어요,2024.2.10
63772,,,,,정****,5,비누향이라는 말이 많아서 그냥 흔한 향일줄 알았는데 전혀 흔하지 않으면서도 편안하고 부드러운 향이에요 좋습니다,2024.2.7
63761,,,,,박****,5,꼬끝에 퍼지면서 아주향기가좋아요,2024.2.6
63765,,,,,네****,5,잘쓰고 있어요 만족합니다만이버시고요(2024-02-05 03:19:13 에 등록된 네이버 페이 구매평),2024.2.6
63744,,,,,정****,5,향이 많이 튀지 않고 은은해서 마음에 듭니다 자연스러운 분위기로 사용하기 좋고 가격도 적정해서 좋습니다.,2024.2.5
63738,,,,,유****,5,"평소에 공병에 소분해서 가지고 다니면서 잘 쓰고 있습니다 향이 독하지 안흔데도 지속력이 좋아서 오후에 약속있을때만 한번 더 뿌려주는 정도예요 손목에 한번, 목 뒤에 한번씩 뿌려주면 딱 좋네요",2024.2.5
63732,,,,,오****,5,향이 은은하고 좋습니다. 항상 사용하고 있어요.,2024.2.5
63731,,,,,오****,5,너무 좋습니다.! 은은해서 이불에도 뿌리고있어요.,2024.2.5
63730,,,,,오****,5,항상 잘쓰고있습니다. 은은해서 좋아요.,2024.2.5
63726,,,,,최****,5,저는 여성제품보다 남성용으로 나온 제품이 향이 더 잘맞더라고요. 남편과 같이 사용하다 제걸로 다시 구매했어요 역시 너무 좋아요,2024.2.4
63725,,,,,박****,5,냄새도좋고 너무좋아요 주변사람들이 무슨향수냐고 계속 묻네요,2024.2.4
