review_uid,product_name,product_price,product_type,username_1,username_2,rating,review_content,review_date
59525,,,,,네****,5,동생한테 선물했는데 향이 은은하게 좋다고합니다!(2023-04-19 09:10:29 에 등록된 네이버 페이 구매평),2023.4.20
59494,,,,,망****,5,아침에 출근 전에 뿌리고 있습니다. 회사에서 향 좋다고 하더군요. 당분간은 이 향수만 사용할겁니다.,2023.4.19
59505,,,,,네****,5,빠르고 편리해서 좋습니다(2023-04-18 19:00:40 에 등록된 네이버 페이 구매평),2023.4.19
59512,,,,,네****,5,지속시간 그리고 좋은 향기(2023-04-18 14:51:16 에 등록된 네이버 페이 구매평),2023.4.19
59488,,,,,조****,5,발렌타인데이 선물로 신랑 사준건데 향 너무너무 맘에 든대영~~할인된 가격에 쿠폰써서 저렴하게 잘샀네요~잘쓸거 같아용~~,2023.4.18
59484,,,,,송****,5,"저는 처음에 느껴지는 향보단 시간이 지나면서 은은하게 퍼지는 비누향이 정말 매력적이게 느껴지네요ㅎ 이번이 4개째인데 각각의 제품이 모두 매력있네요ㅎ 미드나잇,더바디,핫스터프,오리지널 이렇게 사용해봣네요ㅎ",2023.4.18
59474,,,,,정****,5,포근하면서 안아주고 싶은 느낌을 받는 그런 향 !!!,2023.4.18
59491,,,,,네****,5,지속력도 좋고 향이 너무 좋아요(2023-04-17 00:58:50 에 등록된 네이버 페이 구매평),2023.4.18
59464,,,,,권****,5,바디 나올때 부터 계속 사용하다보니 다른 향수를 못쓰겠어요~,2023.4.17
59454,,,,,네****,5,두번째 재구매 입니다 은은하게 향 오래가서 좋아요(2023-04-14 17:07:32 에 등록된 네이버 페이 구매평),2023.4.15
59440,,,,,청****,5,무난하게 사용할 수 있는 향수 찾다 구매했는데 향도 좋고 은은하게 퍼지는게 제 마음에 쏙 듭니다.,2023.4.14
59434,,,,,장****,5,포근한 향?😊 남자친구 생일 선물로 구매했는데 제가더 ㅋㅋ 만족해요,2023.4.13
59428,,,,,d****,5,완전 너무좋아요 번창하세요 대박나세요,2023.4.13
59423,,,,,손****,5,인생 향수 그냥 넘사벽 최고입니다 앞으로도 계속 사야겠어요,2023.4.12
59416,,,,,정****,5,여자친구가 좋아하는 향입니다. 어디에 뿌려도 잘 어울려요,2023.4.12
59414,,,,,j****,5,제가 제일 좋아하는 향이예요.. 제작년에 사용하고 작년에 제가 노스탤지어를 사용해서 더 바디를 구입해 멀리 떠나는 지인에게 선물했어요..  그분이 감동받고 눈물을 흘리시며 정말 좋아했던 기억이 있네요.. 올해 또 친한 사람 생일이라 다시 구입했어요.. 열흘뒤 생일인데 벌써 선물을 줄 기대를 해요.. 어떤 표정일까..  향은 은은하게 오래 여운을 남기네요~,2023.4.12
59403,,,,,양****,5,봄철 뿌리기 좋아요. 따스하고 포근한 느낌을 받았어요,2023.4.11
59397,,,,,이****,5,은은한 향기가  봄에잘어울리는거같아요~향이좋아요~,2023.4.10
59391,,,,,매****,5,향 좋습니다. 만족해요. 매일 어떤 향수 뿌릴까 했는데 더바디가 적합하다 생각해요,2023.4.10
59390,,,,,고****,5,원래 향수에 관심 없는 편이었는데 친구가 향수를 뿌리면 좋은 인상을 줄 수 있다고 했어요. 그 말 듣고 나에게 맞는 향수를 올리브영에서 찾다가 만난 아프리모 향수. 처음에는 달콤한 향이 나는것 같다가도 점차 은은하게 향이 감도는게 저는 너무 좋았습니다. 주변에도 좋은 인상을 남겼길 기대하며 사용해보려고요,2023.4.10
59387,,,,,민****,5,언제써도 항상 만족중입니다 ㅎㅎ 너무 좋아요,2023.4.9
59361,,,,,s****,5,배송도 빠르고 향이 강하지 않고 은은해서 부담스럽지 않아 좋아요. 포장도 고급스러워서 선물하기에도 좋아보여요(2023.04.07 네이버 스마트스토어 후기 입니다.),2023.4.7
59357,,,,,호****,5,저는 보통 향수를 고를 때 지속력도 중요하고 다른 사람의 반응을 얼마나 끌어 올릴 수 있는가를 중요하게 생각해요. 더바디 향수는 뭔가 뿌린듯 안뿌린듯 한데 사람은 달라보이게해요. 묘하게 달라보이는 그런 ㅋㅋ,2023.4.7
59347,,,,,이****,5,선물용으로 구매했는데 아주 좋아합니다 감사해요 ~,2023.4.6
59345,,,,,장****,5,퀵기사님 물량 많으셔서 늦게까지 안와 다음날 오셔도 된다고 했는데 죄송하다고 하시면서 너무 친절하시고 고생 많으시네요~항상 애용하는 아프리모여서 제품은 물론 포장 다 맘에 드는건 당연한 일이네요~더바디 행사로 좀 저렴하게 구매했네요~다 쓰면 또 올께요~ㅎ,2023.4.6
59342,,,,,금****,5,"더바디 남자 향수 사용한지 오래되었네요 ㅎㅎ 출시 이후로 이거만 쓴거같은데, 지금 여자친구나 전 여자친구나 다 같은 말 '향좋다' 친구들 한테도 소개해주지 않는 제 애장템 입니다.",2023.4.6
59338,,,,,보****,5,"더바디 남자 향수는 제가 자주 사용하는 향수 입니다. 매일 뿌려도 좋고, 질리는거는 당연 없지만 주변에서도 좋은 향기가 난다는 말을 정말 많이 듣는거 같아요. 그래서 매번 정기구매로 구매하고 있어요",2023.4.6
59337,,,,,金****,5,은은한 향 더바디~나이를 먹어감에 있어 남자들도자기관리가 필요하지요 더바디 하나면 모든것이 해결 됩니다 호감가는 남자의향  더바디  최고예요,2023.4.6
59334,,,,,조****,5,"구매후 지속사용중!! 조금 남았지만-구매 예정이에요-늘-향이..,지속 지속 은은한 향이 아주 환상적입니다가자- 구매하러^^",2023.4.6
59320,,,,,대****,5,"나름 만족하고 사용중. 향기는 두말 할 것 없이 좋은데, 포근하면서 살짝 느껴지는 달콤한? 그게 있음",2023.4.5
59327,,,,,네****,5,항상 이용 하고 있습니다 ~ 향이 좋네요 ^^(2023-04-04 17:44:26 에 등록된 네이버 페이 구매평),2023.4.5
59308,,,,,민****,5,"어딜가나 향 좋다 무슨 향수냐 물어봅니다!!!별로라는 사람 하나 없는 진짜 나만 알고싶은 향수,,",2023.4.4
59300,,,,,d****,5,남자친구 선물로 구매한 더바디 향수. 어떤 옷에서든 잘 어울리는 향기같아요. 유튜브 호박스님 영상 보고 구매한건데 진짜 안아주고 싶을 정도로 포근한 향기라는 느낌이 들던데요! 앞으로도 쭉 뿌려줬으면 좋겠다 ㅎ,2023.4.4
59293,,,,,최****,5,"자신감 넘치는 하루, 청결함이 주는 편안함. 시선을 사로잡는 살냄새, 이제는 섬세하게 표현하세요.",2023.4.4
59291,,,,,최****,5,항상 이향수를 사용하고 있습니다.벌써4년넘게 사용한거 같네요재구매 합니다,2023.4.3
59296,,,,,네****,5,항상 사용하고있습니다(2023-04-02 22:23:49 에 등록된 네이버 페이 구매평),2023.4.3
59274,,,,,네****,5,"향이 마음에 들고, 지속력도 좋아요(2023-03-30 11:18:32 에 등록된 네이버 페이 구매평)",2023.3.31
59259,,,,,장****,5,남자친구 선물로 구매했어요! 아직 선물하기 전인데 좋아했으면 좋겠어요 ㅎㅎ 상자 보니까 디자인이 예뻐서 제 마음에도 쏙들고 별도로 포장하지 않아도 될거같아요,2023.3.30
59258,,,,,천****,5,남성미 넘치는 향이 아니고 뭐랄까.. 다른 리뷰들 처럼 포근한 느낌이 강해요. 부드러운 향기 덕분에 인상도 좋아지는거 같은?느낌 ㅎㅎ,2023.3.30
59254,,,,,권****,5,재구매입니다 예전에 다른 제품을 써봤지만 더바디가 제일 좋네요 ♡,2023.3.30
59239,,,,,건****,5,향수를 뿌리고 다닌 시간이 얼마 안되긴 하지만 다른 향수들에 비해 정말 포근한 느낌이 강해요. 매력적이로 보이는거같기도하고 ㅎ,2023.3.29
59227,,,,,강****,5,지속력도 좋고 상자도 예뻐서 선물하기 좋을거같아요!!,2023.3.28
59222,,,,,ㄱ****,5,향이 너무 좋아서 2년동안 계속 사용하고있습니다.,2023.3.27
59221,,,,,정****,5,남자친구 생일 선물로 선물한 향수에요. 요즘 선물 향수로 떠오르길래 골라봤는데 뭔가.. 남자친구 선물이 아니라 제 선물같아요 ㅋㅋㅋㅋ 😂😂 제가 더 만족한다니까요 ㅋㅋ 안아주고 싶고 설레이는 느낌을 받았어요. 최고다..,2023.3.27
59219,,,,,김****,5,배송도 빠르고 좋아요  꾸준히 사용합니다,2023.3.27
59212,,,,,진****,5,한번 사용후 향수 어떤거 사용하냐고 묻는 사람이 있어계속 사욤중 쟁여놓고,2023.3.26
59217,,,,,네****,5,언니꺼 향 맡고 향이 고급지고 넘좋아서 찾아봤는데 마침 할인까지하기에 망설이지않고 바로샀습니다 도착해서 맡으니 더좋은거같아서 향수 다쓰기전에 바로 살거같네요ㅎ(2023-03-25 12:50:59 에 등록된 네이버 페이 구매평),2023.3.26
59206,,,,,d****,5,완전너무좋아요 항상 잘쓰고 있습니다 감사합니다,2023.3.25
59205,,,,,황****,5,더바디 남자 향수랑 위버섹슈열 퍼퓸왁스를 같이 시켰는데 더바디 향수는 상큼한 과일향도 나면서 은은하고 부드럽고 퍼퓸왁스는 정말 지금까지썼던 왁스와는 다르게 인공적인 향이 아니라 자연스럽고 섹시한 향도 나고 부드럽게 잘발리더라구요!! 역시 아프리모제품은 언제나 믿고사는것같네요!!너무 좋은제품이라 지인들한테도 꼭 추천해주는데 다들 아프리모는 믿고 구매하시면 될꺼같아요. 향자체가 넘사벽이네요 ㅎㅎ,2023.3.25
59193,,,,,교****,5,박스 디자인이 예쁘네요 ~ 이런 향수 처음 사봤어요 ㅎ 물론 향도 마음에 들어서 아침저녁으로 뿌리려고합니다!,2023.3.24
59200,,,,,네****,5,감사합니다 잘 쓸게요(2023-03-23 19:14:19 에 등록된 네이버 페이 구매평),2023.3.24
59183,,,,,중****,5,자연스러운 향기입니다. 나 향수 뿌렸어! 하는 느낌 하나 없이 제 피부에서 원래 이런 향이 났었나 싶은 진짜 그런 향.👍👍 여사친 말로는 미묘하게 끌리는 향기라며 제 얼굴이 아니라 다른 얼굴이었으면 키갈했다고 하네요…ㅅ..ㅎ..,2023.3.23
59188,,,,,네****,5,선물로구매했는데 좋아요!(2023-03-22 20:46:07 에 등록된 네이버 페이 구매평),2023.3.23
59166,,,,,장****,5,자연스러운 향기의 표본이 될 향수 ! 😊 몸에 잘 베어 나오는 향 덕분에 기분이 좋아지고 주변 반응도 좋아요. 아직 하루밖에 쓰지 않았지만 기분이 좋아지는건 사실!,2023.3.22
59157,,,,,세****,5,향이 좋아요 외출 시에 꼭 사용하는 향수 !,2023.3.21
59164,,,,,네****,5,일단 향기가 탑노트 바텀노트 둘다 훌륭하고 지속력도길어서 좋아요(2023-03-20 14:38:03 에 등록된 네이버 페이 구매평),2023.3.21
59154,,,,,인****,5,향이 너무 좋아요:)믿고 쓰는 아프리모 향수핫스터프 쓰다가 더바디 처음 써보는데 향이 너무 좋네요:)은은하니 오래 가는거 같아요~여자친구도 너무 좋다고 안기네요^^더바디 남자 추천합니다!!!!!,2023.3.20
59148,,,,,네****,5,냄새아주좋네요ㅎㅎㅎ(2023-03-19 21:01:41 에 등록된 네이버 페이 구매평),2023.3.20
59149,,,,,네****,5,첫 향수 주문이여서 걱정울 했는데 원하는 느낌의 비누향이여서 좋아요!(2023-03-19 21:41:18 에 등록된 네이버 페이 구매평),2023.3.20
59130,,,,,강****,5,감사합니다 요거 매번 사용하고 있고요ㅎㅎ 오늘 언박싱해서 뿌렸네요~감사합니당,2023.3.18
59129,,,,,서****,5,"이건 제게 있어 인생 향수입니다. 오랜기간 미드나잇블루만 쓰다가 궁금해서 샀는데 진짜 너무 제 스타일이고, 주변에서도 향수 뭐냐고 많이 물어봅니다. 나이에 싱관없이 모두 좋다고 했어요.",2023.3.18
59122,,,,,민****,4,은은한 향기가 자극적이지 않아 모든 장소에 사용하기에좋은 향수라는 생각이 듭니다..,2023.3.17
59119,,,,,호****,5,향이 좋아서 자꾸 손이가는 향수 ~~,2023.3.17
59118,,,,,채****,5,마치 나에게서 퍼지는 듯한 환상이 확 들게하는 더바디 향수. 포근한 향기가 감도니 누구에게나 좋은 호감을 불러일으켜주어요. 이 향수를 사용하고 여러 사람 만나봤지만 별로라는 말은 못들어본 거같습니다.,2023.3.17
59117,,,,,김****,5,내가 좋아하는 향이다!약간의 양으로 내 몸에서 좋은 냄새가 난다.,2023.3.17
59126,,,,,네****,5,너무너무조아여.향이.대박입니다.(2023-03-16 19:28:27 에 등록된 네이버 페이 구매평),2023.3.17
59111,,,,,박****,5,벌써 3년이 넘는 시간 동안 아프리모 제품만 사용하고 있습니다더바디 사용하면서 예전에는 광고 같은 일도 격었습니다엘리베이터에서 한 여성이 어떤 향수 쓰냐고 물어보더라구요ㅋㅋ앞으로도 좋은 제품 많이 만들어주세요ㅋㅋㅋㅋ,2023.3.16
59109,,,,,이****,5,배송도빠르고 향도 아주 좋아요 만족합니다~,2023.3.16
59108,,,,,안****,5,예전에 많이사용했었는데 한동안사용을 잘안하다가 다시사용할려고 주문했어요 향은 너무좋아요 이향수 뿌리고나가면 예전여자친구들도 다들 행 좋다고 몸에서 좋은냄새난다고까지했었으니까  예전생각나서 다시 주문해봤어요 역쉬나 향좋네요.,2023.3.16
59105,,,,,양****,5,비누처럼 소프트한 사용감이 있어요. 막 씻고나와서 수건으로 탈탈 털때 풍기는 그런 향? 여자친구도 향수 잘 골랐다고 해요,2023.3.16
59104,,,,,진****,5,처음 향수 사용해보는건데 사길 잘했다는 생각이 들어요! 첫 향부터 마지막까지 느껴지는 잔향까지 이게 향수구나 싶을 정도로 마음에들어요 ㅎㅎ 제 인상도 달라보인다고 얘기 듣곤해요,2023.3.16
59114,,,,,네****,5,따뜻한 느낌의 향이 너무 좋네요~지속성도 괜찮은듯 합니다.(2023-03-15 16:29:31 에 등록된 네이버 페이 구매평),2023.3.16
59094,,,,,정****,5,그냥 모든 머스크 비누향 향수들 다 써봐도 이만한 비누향 샤워하고 나온 냄새 없습니다 향도 너무 쎄지않고 적절하게 잘 나서 너무 좋고 잔향도 엄청 좋은거같아요 앞으로 쭉 번창하고 없어지지 말아주세요 ㅠㅠ,2023.3.15
59080,,,,,김****,5,오리지널만 꾸준히 사용하다가 더바디를 한번 사용해소게 되었습니다. 오리지널은 뭔가 찐하면서 무게감이 좀 있다면 더바디는 가벼운 느낌이에요. 시간이 지나면 진짜 살 냄새같은 느낌. 기분에 따라 오리지널과 더바디를 바꿔가며 사용하면 다른 느낌을 줄 수 있어 좋은 거 같습니다.,2023.3.14
59072,,,,,네****,5,선물로 줬는데 마음에 들어하네요~(2023-03-12 16:53:21 에 등록된 네이버 페이 구매평),2023.3.13
59074,,,,,네****,5,인셍향수 인정합니나(2023-03-12 15:13:29 에 등록된 네이버 페이 구매평),2023.3.13
59051,,,,,최****,5,향이 진하지 않고 오래가 잘 사용하고 있습니다.개인적으로 강한 향보다 은은한 향을 좋아해오래도록 쓰고 싶습니다.,2023.3.10
59040,,,,,이****,5,4번째 쓰는데 ...이것만 찾게 되네요 ㅎㅎ,2023.3.9
59017,,,,,상****,5,여자들이 좋아하는 향수 1티어. 자연스럽게 퍼지는 향기가 진짜 호감을 불러일으키는 느낌,2023.3.8
59034,,,,,네****,5,여자친구가 아주 좋아합니다ㅎㅎ(2023-03-07 10:54:23 에 등록된 네이버 페이 구매평),2023.3.8
59003,,,,,김****,5,오리지널 오랫동안 사용해 왔는데 다른 느낌을 한번 주고 싶어서 구매했습니다. 오리지널하고는 확실히 다른 느낌이에요. 좀 더 가벼우면서 편안한 느낌? 오리지널보다 제가 맡을 수 있는 첫 향은 좀 더 빨리 날라가는거 같기는 하지만 그만큼 더 오래 은은하게 남는거 같아요.,2023.3.7
58995,,,,,신****,5,얘들아 향이 너무 좋아서 하나 다시 구매했어산듯하면서 은은하게 퍼지는 다바디 향수남친 선물이나  나 자신에게 투자 한번 해봐후회하지 않을꺼야망설이지 말고 저렴할때 구매해망설이는 순간 행사기간 지나간다향긋한 향수 더바디와 따뜻한 봄을 맞이 하는건 어때?,2023.3.6
58988,,,,,윤****,5,"과하게 진한 향은 오히려 반감이 난다고 하잖아요. 더바디 향수는 진하지 않고 은은하고 비누의 포근하면서.. 향을 맡고만 있어도 기분이 좋아져요. 여자친구도 이전에 사용한 향수 말고 제발 이거만 뿌리라고,,ㅋㅋ",2023.3.6
58987,,,,,예****,5,싱그럽게 느껴지는 비누향기가 출근할때나 친구들이랑 놀 때도 좋아요. 과한향기가 아닌데다가 미묘한 향기가 기분좋게해줘요,2023.3.6
58981,,,,,네****,5,오빠꺼랑 해서 샀는데 향이 좋아서 매일 뿌려요(2023-03-04 08:53:19 에 등록된 네이버 페이 구매평),2023.3.5
58975,,,,,네****,5,한달사용 후 적당한 향입니다. 잘 사용중입니다.(2023-03-03 23:38:17 에 등록된 네이버 페이 구매평),2023.3.4
58965,,,,,정****,5,물건 잘 받았어요. ^^너무 빠른 배송 감사합니다.그리고 드디어 저두 아프리모를 쓰게 되어서 너무 기쁘고 설레이네요 🫶❤️,2023.3.3
58951,,,,,서****,5,다른 향수사용하다  우연히 더바디향수를알게되어 구매했는데 향이너무 맘에들어다음에도 재구매할겁니다,2023.3.2
58948,,,,,전****,5,데이트할 때 자주 뿌리는 향수에요. 가볍게 뿌릴 수 있고 향기도 좋아서 저나 여자친구 모두 좋아하는~ 그런 향수,2023.3.2
58943,,,,,김****,5,재재재구매 합니다 향이 너무 좋네요 굿굿,2023.3.2
58958,,,,,네****,5,살냄새 최고예요ㅎㅎ 더 구매 할 예정입니다ㅎ(2023-03-01 22:40:52 에 등록된 네이버 페이 구매평),2023.3.2
58959,,,,,네****,5,이제 4통째 쓰는 향수네요마침 할인도 하고 있어서 좋은 가격에 구매했습니다(2023-03-01 21:56:58 에 등록된 네이버 페이 구매평),2023.3.2
58960,,,,,네****,5,첨 사용해 봤는데 은은하고 좋습니다(2023-03-01 20:28:07 에 등록된 네이버 페이 구매평),2023.3.2
58962,,,,,네****,5,남편이 향이좋다고 맘에들어하네요~~(2023-03-01 19:36:51 에 등록된 네이버 페이 구매평),2023.3.2
58963,,,,,네****,5,고급 비누향 느낌 나름 괜찮네요(2023-03-01 15:06:03 에 등록된 네이버 페이 구매평),2023.3.2
58931,,,,,김****,5,아프리모 향수를 수년간 사용한 것은 주변의 모든 사람들이 향기 좋다는 말을 하기 때문이다..아프리모향수는 누구에게도 실망시키지 않는 좋은 제품이다..,2023.3.1
58918,,,,,나****,5,"더바디의 앰버, 바닐라, 머스크의 향이 포근한 향을 잘 표현해준거 같습니다. 아늑하고 매력적인 향기가 있고 단향보다는 관능적으로 감싸주는게 기분이 좋아지는 그런 향수네요",2023.2.28
58928,,,,,네****,5,너무 좋아하는 향..(2023-02-27 00:36:50 에 등록된 네이버 페이 구매평),2023.2.28
58910,,,,,진****,5,더바디 향수를 뿌리니까 뭔가 자신감도 생기고 주변에서 향에 대한 칭찬도 해주니 기분이 좋아졌어요. 이전보다 자신감도 생기고 외출할 때 위축되기 보다 어떤 옷이랑 더 매치하면 좋을지 생각도 하게되고 나를 꾸미는게 뭔지 즐거움도 알게되었어요~!! 막 씻고나온 듯한 비누처럼 포근한 향이 매력적이라 남들에게 추천하고 싶을 정도!,2023.2.27
58915,,,,,네****,5,향이 부담이 없이 좋아서 자주 뿌리게 되네요(2023-02-26 21:31:58 에 등록된 네이버 페이 구매평),2023.2.27
58900,,,,,네****,5,향이 너무 좋습니다!(2023-02-25 21:47:50 에 등록된 네이버 페이 구매평),2023.2.26
58892,,,,,네****,5,사용해보니 좋았습니다.(2023-02-24 16:04:28 에 등록된 네이버 페이 구매평),2023.2.25
58895,,,,,네****,5,항상 쓰는 향수입니다(2023-02-24 10:36:49 에 등록된 네이버 페이 구매평),2023.2.25
58878,,,,,양****,5,아프리모 더바디 향수는 미묘하게 제 몸에서 나오는 향기처럼 느끼게 해줘요. 여러 번 뿌려보진 않았지만 기분 좋은 향기는 처음 ㅎㅎ,2023.2.24
58869,,,,,진****,5,"부드러운 향기와 체향이 완벽하게 어우러져서, 입체적이면서도 우아한?향입니다. 순수한 꽃 향기와 나무 향이 조화롭게 어우러져 자연스러우면서도 세련된 분위기가 있어요",2023.2.23
58867,,,,,d****,5,너무좋아요번창하세요수고하세요,2023.2.23
58854,,,,,정****,5,은은한 비누향이 감돌아서 마음에 듭니다 👍 사람들에게 너무 돋보이지 않으면서도 좋은 향기를 전달하는 것 같아서 자주 사용하고 있어요.,2023.2.22
58844,,,,,박****,5,처음 구매하고 시향을 했을때 향이 너무 좋아서 재구매 의사가 있었는데 할인을 하고 있어서 3개 추가로 구매 하였습니다,2023.2.21
58838,,,,,조****,5,머스크 향이 강하지 않고 은은하게 본래의 향을 풍기게 잡아줘서 좋아요 ! 깔끔하고 남성들이 사용하면 좋을 그런 향 ㅎㅎ 병도 예쁘고 퀄리티 있어 보여서 선물하기에도 좋을 거 같아요.,2023.2.21
58846,,,,,네****,5,이렇게 향이좋을줄이야(2023-02-20 13:05:37 에 등록된 네이버 페이 구매평),2023.2.21
58823,,,,,천****,5,"향수를 사용하면서 저는 사용감을 굉장히 중요시 여기는 타입입니다. 분사력이 좋아야하고 가볍게 뿌려도 잘퍼지는 향수를 선호해요.더바디 향수는 지속력도 좋고 내가 많이 뿌리지 않았음에도 불구하고 제 몸에서 나는 향기라는 생각을 불러일으킬 정도로 기분좋은 향이였어요.진짜로 제 몸에서 그렇게 느껴지면 소원이 없을지도,,더바디의 특징은 아무래도 남들과 다른 나만의 향인데, 제 친구가 뿌렸을 때랑 제가 뿌렸을 때랑 조금 미묘한 차이가 있었어요.재미도 있고 향도 좋고 자주 사용하려고요.",2023.2.20
58822,,,,,연****,5,남편 생일 선물로 구매 😚 은은하게 퍼지는 향이 마음에 들어요,2023.2.20
58819,,,,,네****,5,향이ㅡ정말 좋아요.뿌리고 나서 시간이 지날수록 향이 더 좋아져요.(2023-02-18 16:18:55 에 등록된 네이버 페이 구매평),2023.2.19
58802,,,,,권****,5,매번 이것만 써요 어떤 스타일에도 좋아요,2023.2.18
58791,,,,,만****,5,"디자인은 고급스럽고 사람의 몸 형태인데, 외관이 너무 예뻐서 선물용으로도 좋을듯 합니다. 저한테 선물하는 기분이 드네요.",2023.2.17
58789,,,,,이****,5,저는 1통 다쓰고 이번에 세일하길래 2통 더 구매했습니다더바디 특유의 은은한 비누향이 나요주변에서도 향이 좋다고 향수 뭐 쓰냐고 많이 물어봤어요남녀 둘다 사용가능한 자연스러운 향입니다,2023.2.17
58780,,,,,성****,5,오늘.아침에 바로 향수집에서 사알짝 뿌렸는데ㅎㅎㅎ옆에 친구가 어?향수?ㅎㅎ하면서 계속 킁킁되는데ㅎㅎ개인적으로 전 마구마구 진한 스치면지나갈때 윽!향수냄새ㅠㅠ이런 고가의향수지만 개인적으로 별로 ㅎㅎ추천추천드립니다아,2023.2.16
58775,,,,,건****,5,계속 사용하게 되는 마성의 향을 가진.. 그런 향수... 여자친구가 향을 정말 좋아해요,2023.2.16
58787,,,,,네****,5,항상 좋은 향 판매하여 감사합니다(2023-02-15 08:35:50 에 등록된 네이버 페이 구매평),2023.2.16
58767,,,,,박****,5,하나 구매하고 사용했는데 향이 너무 좋아서 재구매 생각하고 있었는데 할인 중이라서 미리 사뒀어요 다음에는 다른 향수도 사용할 생각입니다,2023.2.15
58766,,,,,성****,5,배송이 주문하고~부산인데 다음날 바로오다니ㅎ저는향수에대해 모르고 워낙 시중에 너~무 브랜드들이 다양해서 도저히 선택이 안되던와중 발견한 향수가 이제품 인데 제일 정확한 리뷰가 더바디 남자향수 상세정보에 사진들 에서 느껴지는게 향수에다 담겨져있는거같아요 사진을보면 이 향이생각이나고 이향을 맡으면 그사진이같이너무 잘맞아서 개인적으로 너무추천드리는 향수입니다 은은하고 계속 맡고싶어지는향인데 진짜매력있는향인데 참..그....,2023.2.15
58765,,,,,건****,5,"어떤 옷을 입어도 잘 어울려서, 여자친구한테 칭찬 받는 향수👍 원래 향수 안뿌리고 다녔는데 반응이 달라서 요즘에는 매일 뿌려요.",2023.2.15
58764,,,,,진****,5,"제 친구가 운동하고 나와서 꼭 뿌리는 향수인데, 개인적으로 취향에 잘 맞았어요. 그래서 사야지 사야지 고민만 하다가 이번에 드디어 영접했는데 정말 좋아요. 기분이 좋아지는 그런 향수👍",2023.2.15
58757,,,,,t****,5,향이 좋아서 자꾸 손이가는 향수에요. 다른 분들도 맡아 보고 나서 좋다고 막 그래요 ㅎ,2023.2.15
58733,,,,,운****,5,배송도 너무 빠르고 잘 포장되어 와서 추천드리고 햔도 너무 마음에.들고 향도 좋고 잘쓰고 다닐도록 할께여,2023.2.14
58750,,,,,네****,5,냄새도 좋고 다 좋아요 다음에도 구매할게여(2023-02-13 12:21:58 에 등록된 네이버 페이 구매평),2023.2.14
58752,,,,,네****,5,좋은 제품 잘받았습니다(2023-02-13 11:30:59 에 등록된 네이버 페이 구매평),2023.2.14
